{
  "id": "dror21-s03a-fr-cert-genai-2026-page",
  "publisher": "CERT-FR / Agence nationale de la sécurité des systèmes d'information (ANSSI)",
  "title": "Generative AI and Cyberattacks — 2025 Threat Summary",
  "url": "https://www.cert.ssi.gouv.fr/cti/CERTFR-2026-CTI-001",
  "published_at": "2026-02-04",
  "accessed_at": "2026-08-12"
}
