{
  "id": "DORR17-S01-MSMT-2025-2",
  "publisher": "Multilateral Sanctions Monitoring Team",
  "title": "The DPRK's Violation and Evasion of UN Sanctions through Cyber and Information Technology Worker Activities (MSMT/2025/2)",
  "url": "https://msmt.info/view/save/2025/10/22/26294780-c396-407d-bb33-88afe988cd96-The_DPRK%E2%80%99s_Violation_and_Evasion_of_UN_Sanctions_through_Cyber_and_Information_Technology_Worker_Activities_(MSMT_2025_2).pdf",
  "published_at": "2025-10-22",
  "accessed_at": "2026-08-12"
}
