{
  "id": "src-d5fdc8f9e16c",
  "publisher": "U.S. Department of the Treasury, Office of Foreign Assets Control",
  "title": "Issuance of Syria-related and Cyber-related Executive Orders; North Korea and Sudan Designations; Russia-related Designation Removal; Settlement Agreement between OFAC and Family International Realty LLC",
  "url": "https://ofac.treasury.gov/recent-actions/20250116",
  "published_at": "2025-01-16",
  "accessed_at": "2026-08-14",
  "sha256": "b29feacf81a0d6202d3a1d9ef3c8d0577266e4dbd7ab3680515c6eeef6480076",
  "content_type": "html",
  "languages": [
    "en"
  ]
}
