{
  "id": "src-a604322d8714",
  "publisher": "GitHub",
  "title": "GitHub user status: MinionGit",
  "url": "https://api.github.com/users/MinionGit",
  "accessed_at": "2026-08-14",
  "sha256": "fa4600144599e8318e4376c319e7e69b7486837bf67421312a2f9e100ae001cf",
  "content_type": "dataset",
  "languages": [
    "en"
  ]
}
