{
  "id": "DOLG25-S03A-KNOOT-RELEASE-ORDER-155",
  "publisher": "Free Law Project / CourtListener docket reproduction",
  "title": "United States v. Matthew Isaac Knoot, order denying release pending appeal, Document 155",
  "url": "https://www.courtlistener.com/docket/69026861/155/united-states-v-knoot",
  "published_at": "2026-06-24",
  "accessed_at": "2026-08-12",
  "content_type": "html",
  "languages": [
    "en"
  ]
}
