{
  "id": "src-d261a70377a1",
  "publisher": "The Hacker News",
  "title": "DoJ Indicts 5 Individuals for $866K North Korean IT Worker Scheme Violations",
  "url": "https://thehackernews.com/2025/01/doj-indicts-5-individuals-for-866k.html",
  "published_at": "2025-01-24",
  "accessed_at": "2026-08-14",
  "sha256": "c2695578940954d5225d02b9b649060ae58a38e387327f8574288e6ffa616fdd",
  "content_type": "html",
  "languages": [
    "en"
  ]
}
