{
  "id": "un-s-2023-656",
  "publisher": "United Nations Security Council Panel of Experts",
  "title": "Final report of the Panel of Experts submitted pursuant to resolution 2680 (2023)",
  "url": "https://docs.un.org/en/S/2023/656",
  "published_at": "2023-09-07",
  "accessed_at": "2026-08-16",
  "sha256": "e50f153d12bef198e2820d35bd608537fe19911210408d2229095095437c98d6",
  "content_type": "pdf",
  "languages": [
    "en"
  ]
}
