{
  "id": "deep2-ttp-deep-ttp-s1-bbc-korea-2026-internal-records-deep-ttp-04-shared-residential-work-farm",
  "publisher": "BBC News Korea",
  "title": "북한 IT 위장 취업조직의 실체…BBC가 입수한 북한 내부 기록을 열어보니 [Inside a DPRK IT employment-fraud organization: BBC reviews internal North Korean records]",
  "url": "https://www.bbc.com/korean/articles/clyx7gkyjr1o",
  "published_at": "2026-06-26",
  "accessed_at": "2026-08-12"
}
