{
  "id": "crypto-nknews-consensys",
  "publisher": "NK News",
  "title": "Leading cryptocurrency firm denies reports it hired a North Korean IT worker",
  "url": "https://www.nknews.org/2026/07/leading-cryptocurrency-firm-denies-reports-it-hired-a-north-korean-it-worker",
  "published_at": "2026-07-21",
  "accessed_at": "2026-08-12",
  "sha256": "5db8e8e56074aa9fb086f086739ef84b234cfafd58ee3b3267b31cfb9fb9b15e",
  "content_type": "html",
  "languages": [
    "en"
  ]
}
