{
  "id": "doaa-s13",
  "publisher": "U.S. Department of State, Rewards for Justice",
  "title": "Yanbian Silverstar and Volasys Silverstar",
  "url": "https://rewardsforjustice.net/rewards/yanbian-silverstar-and-volasys-silverstar",
  "published_at": "2024-12-12",
  "accessed_at": "2026-08-12",
  "sha256": "db7ff0e8e361b632bf895587a370e3de1bf7d98613628b1fdfdc6a11ae741334",
  "content_type": "html",
  "languages": [
    "en"
  ]
}
