{
  "id": "src-eb352b5640a2",
  "publisher": "Federal Bureau of Investigation",
  "title": "FBI Wanted Person API record for Ko Chung Sok",
  "url": "https://api.fbi.gov/@wanted-person/ac3eaadb0e424a39ab3a1a4de512d174",
  "published_at": "2024-11-12",
  "accessed_at": "2026-08-13",
  "sha256": "824f01fa8bb1a9a75e0a7a4f4203c4496c8d2346816b5162aaaba4540c7c3dd7",
  "content_type": "dataset",
  "languages": [
    "en"
  ]
}
