{
  "id": "DCLR16-S02-GOVTECH-PONTEM-2025",
  "publisher": "Government Technology",
  "title": "North Korean Hackers Are Applying for Your IT Jobs",
  "url": "https://www.govtech.com/workforce/north-korean-hackers-are-applying-for-your-it-jobs",
  "published_at": "2025-10-23",
  "accessed_at": "2026-08-12",
  "note": "Link check on 2026-10-19: the source URL returns HTTP 404. No current canonical article was found in the publisher sitemap search, and the Wayback availability API and CDX index returned no capture for the cited URL. The Pontem Analytics/Kyle McKeen passage could not be reverified. The original URL and existing attribution are retained for provenance; no archived_url is asserted."
}
