{
  "id": "src-50c0f21b3bfe",
  "publisher": "LaborX",
  "title": "Freelancer Code Solution - Skills: Javascript, React, MySQL",
  "url": "https://laborx.com/freelancers/users/id53436",
  "accessed_at": "2026-08-13",
  "sha256": "c07852f79ecdc37379b26de4094f2a92076d7e9fd3e35f3270b79d69841842c7",
  "content_type": "html",
  "languages": [
    "en"
  ]
}
