{
  "id": "src-dea71be0a42e",
  "publisher": "Linktree",
  "title": "Shaorun Zhang | Linktree",
  "url": "https://linktr.ee/shaorunzhang",
  "accessed_at": "2026-08-13",
  "sha256": "232d03161943c914d2438c9a41da76e91907e61cb736e0e5564406e0b031d6b6",
  "content_type": "social",
  "languages": [
    "en"
  ]
}
