{
  "id": "DEPVG27-S04-PINDROP-JOINT-ALERT",
  "publisher": "Pindrop",
  "title": "The FBI's New Alert Says Your Hiring Process Is a Security Perimeter",
  "url": "https://www.pindrop.com/resource/articlethe-fbis-new-alert-says-your-hiring-process-is-a-security-perimeter",
  "published_at": "2026-07-31",
  "accessed_at": "2026-08-12",
  "archived_url": "https://web.archive.org/web/20260908111145/https://www.pindrop.com/resource/articlethe-fbis-new-alert-says-your-hiring-process-is-a-security-perimeter/"
}
