{
  "id": "deep2-vendor-dv-s06-dv-f08",
  "publisher": "SentinelOne SentinelLabs",
  "title": "Top Tier Target | What It Takes to Defend a Cybersecurity Company from Today’s Adversaries",
  "url": "https://www.sentinelone.com/labs/top-tier-target-what-it-takes-to-defend-a-cybersecurity-company-from-todays-adversaries",
  "published_at": "2025-04-28",
  "accessed_at": "2026-08-12"
}
