{
  "id": "src-c64cae56c83b",
  "publisher": "GitHub",
  "title": "GitHub public owner-repository inventory: kanbei0605",
  "url": "https://api.github.com/users/kanbei0605/repos?per_page=100&type=owner&sort=updated&direction=desc",
  "accessed_at": "2026-08-15",
  "sha256": "060f667e554fac2ed918d7b59f6e8ce94b95dfcc9c61e57da9d53b205d636ce5",
  "content_type": "dataset",
  "languages": [
    "en"
  ]
}
