{
  "id": "drp49-unit42-wagemole",
  "publisher": "Palo Alto Networks Unit 42",
  "title": "Hacking Employers and Seeking Employment: Two Job-Related Campaigns Bear Hallmarks of North Korean Threat Actors",
  "url": "https://unit42.paloaltonetworks.com/two-campaigns-by-north-korea-bad-actors-target-job-hunters/",
  "published_at": "2023-11-21",
  "accessed_at": "2026-08-16",
  "sha256": "07d25e88bdf55f68190c117fe9cfe80535b17e80feff05fec5bd84e160127bdc",
  "content_type": "html",
  "languages": [
    "en"
  ]
}
