{
  "id": "src-64a6acbd3166",
  "publisher": "GitHub",
  "title": "GitHub public members: HyperBuildX",
  "url": "https://api.github.com/orgs/HyperBuildX/public_members?per_page=100",
  "accessed_at": "2026-08-14",
  "sha256": "4f53cda18c2baa0c0354bb5f9a3ecbe5ed12ab4d8e11ba873c2f11161202b945",
  "content_type": "dataset",
  "languages": [
    "en"
  ]
}
