{
  "id": "src-2cd5b159d1c6",
  "publisher": "GitHub",
  "title": "GitHub exact historical-indicator user search",
  "url": "https://api.github.com/search/users?q=wangge327%40yahoo.com%20in%3Aemail&per_page=20",
  "accessed_at": "2026-08-15",
  "sha256": "0e0da4c08e8ef26522d7e3e4aef402fae40ebfddb7fce1036e9f464a9c073aeb",
  "content_type": "dataset",
  "languages": [
    "en"
  ]
}
