{
  "id": "src-f467c7980e17",
  "publisher": "GitHub",
  "title": "GitHub organization status: m8s-lab",
  "url": "https://api.github.com/orgs/m8s-lab",
  "accessed_at": "2026-08-14",
  "sha256": "8797d89ca7afa4a8ce2594e23ee109c57a115ae773f9dd4e76ddb8a380e82aee",
  "content_type": "dataset",
  "languages": [
    "en"
  ]
}
