{
  "id": "techcrunch-2026-08-11-federal-agency-worker",
  "publisher": "TechCrunch",
  "title": "North Korean remote IT staffer worked for US government agency, says FBI",
  "url": "https://techcrunch.com/2026/08/11/north-korean-remote-it-staffer-worked-for-us-government-agency-says-fbi",
  "published_at": "2026-08-11",
  "accessed_at": "2026-08-12"
}
