{
  "id": "DIMF-S05",
  "publisher": "The Guardian",
  "title": "British firms urged to hold video or in-person interviews amid North Korea job scam",
  "url": "https://www.theguardian.com/technology/2025/apr/20/british-firms-urged-to-hold-video-or-in-person-interviews-amid-north-korea-job-scam",
  "published_at": "2025-04-20",
  "accessed_at": "2026-08-12"
}
