{
  "id": "src-4d679834b4fe",
  "publisher": "GitHub",
  "title": "GitHub user status: keisukew53",
  "url": "https://api.github.com/users/keisukew53",
  "accessed_at": "2026-08-14",
  "sha256": "3a32eab6ffbfd1cf2684b1a409bf40db46e46c5eaff44de656e499df05d92730",
  "content_type": "dataset",
  "languages": [
    "en"
  ]
}
